{"harness":{"harness_schema_id":"urn:wexp:core-01:vectors-003:harness","label":"WEXP Core-01 vector harness 003","vector_schema_id":"urn:wexp:core-01:vectors-003:vector"},"non_claims":["Profile vocabulary restates the frozen CORE-01 snapshot registries for qualification only."],"orderings":{"base":["observation","intent","invocation","execution"],"qualifier":["PROV","IV"]},"profile_id":"wexp-core-01-vectors-003-profile","profile_version":1,"qualifier_admissibility":{"PROV":["execution"]},"qualifier_independence":{"IV":"supported","PROV":"not-applicable"},"representation":"core-01-qualification-001-harness","scope_keys":["carrier-mapping","authenticity","target-binding","boundary-grounding","observation-support","intent-support","invocation-support","execution-support","provenance-support","independent-verification","composition","counter-evidence"],"semantics_version":"wexp-core-1","status_domains":{"assessment":["supported","unsupported","not-evaluated"],"boundary-grounding":["asserted-only","attributed","attested","not-evaluated"],"counter-evidence":["not-supplied","not-evaluated","resolved-no-defeat","unresolved-material","defeating"],"independence":["supported","unsupported","not-evaluated","not-applicable"]},"token_registry":{"classes":{"fatal":["E_CLAIM_OUT_OF_DOMAIN","E_MALFORMED_NORMALIZED_INPUT","E_PROFILE_MAPPING_INVALID","E_UNKNOWN_CRITICAL_SEMANTIC","E_UNSUPPORTED_SEMANTICS_VERSION"],"gap":["E_IV_NOT_EVALUATED","E_COUNTER_EVIDENCE_NOT_EVALUATED"],"substantive":["E_BASE_EXCEEDS_BOUNDARY","E_MISSING_REQUIRED_EVIDENCE","E_COUNTER_EVIDENCE_UNRESOLVED","P_COUNTER_FAIL"]},"derived_only":["E_MALFORMED_NORMALIZED_INPUT","E_UNSUPPORTED_SEMANTICS_VERSION","E_PROFILE_MAPPING_INVALID","E_CLAIM_OUT_OF_DOMAIN"],"foreign_rejected":[],"roles":{"base_exceeds_boundary":"E_BASE_EXCEEDS_BOUNDARY","claim_out_of_domain":"E_CLAIM_OUT_OF_DOMAIN","counter_evidence_not_evaluated":"E_COUNTER_EVIDENCE_NOT_EVALUATED","counter_evidence_unresolved":"E_COUNTER_EVIDENCE_UNRESOLVED","malformed_normalized_input":"E_MALFORMED_NORMALIZED_INPUT","missing_required_evidence":"E_MISSING_REQUIRED_EVIDENCE","profile_mapping_invalid":"E_PROFILE_MAPPING_INVALID","qualifier_not_evaluated":"E_IV_NOT_EVALUATED","unknown_critical":"E_UNKNOWN_CRITICAL_SEMANTIC","unsupported_semantics_version":"E_UNSUPPORTED_SEMANTICS_VERSION"},"supplied_fatal":["E_UNKNOWN_CRITICAL_SEMANTIC"]},"vector_bindings":{"WEXP-CORE-01-V003-TV-3001":{"classification":"scope-identity-control","requirement_ids":["WEXP-CORE-01-V003-REQ-S3001"],"source_fixture":"S3001"},"WEXP-CORE-01-V003-TV-3002":{"classification":"base-foreign-target-fatal","requirement_ids":["WEXP-CORE-01-V003-REQ-S3002"],"source_fixture":"S3002"},"WEXP-CORE-01-V003-TV-3003":{"classification":"base-foreign-context-fatal","requirement_ids":["WEXP-CORE-01-V003-REQ-S3003"],"source_fixture":"S3003"},"WEXP-CORE-01-V003-TV-3004":{"classification":"qualifier-foreign-scope-fatal","requirement_ids":["WEXP-CORE-01-V003-REQ-S3004"],"source_fixture":"S3004"},"WEXP-CORE-01-V003-TV-3005":{"classification":"boundary-foreign-scope-fatal","requirement_ids":["WEXP-CORE-01-V003-REQ-S3005"],"source_fixture":"S3005"},"WEXP-CORE-01-V003-TV-3006":{"classification":"profile-gap-foreign-scope-fatal","requirement_ids":["WEXP-CORE-01-V003-REQ-S3006"],"source_fixture":"S3006"},"WEXP-CORE-01-V003-TV-3007":{"classification":"mixed-scope-fatal","requirement_ids":["WEXP-CORE-01-V003-REQ-S3007"],"source_fixture":"S3007"}},"verdict_rules":{"precedence":["fatal","substantive","default"],"verdicts":{"default":"accept","fatal":"reject","substantive":"downgrade"}}}
