{"harness":{"harness_schema_id":"urn:wexp:core-01:vectors-002:harness","label":"WEXP Core-01 vector harness 002","vector_schema_id":"urn:wexp:core-01:vectors-002:vector"},"non_claims":["Profile vocabulary restates the frozen CORE-01 snapshot registries for qualification only."],"orderings":{"base":["observation","intent","invocation","execution"],"qualifier":["PROV","IV"]},"profile_id":"wexp-core-01-vectors-002-profile","profile_version":1,"qualifier_admissibility":{"PROV":["execution"]},"qualifier_independence":{"IV":"supported","PROV":"not-applicable"},"representation":"core-01-qualification-001-harness","scope_keys":["carrier-mapping","authenticity","target-binding","boundary-grounding","observation-support","intent-support","invocation-support","execution-support","provenance-support","independent-verification","composition","counter-evidence"],"semantics_version":"wexp-core-1","status_domains":{"assessment":["supported","unsupported","not-evaluated"],"boundary-grounding":["asserted-only","attributed","attested","not-evaluated"],"counter-evidence":["not-supplied","not-evaluated","resolved-no-defeat","unresolved-material","defeating"],"independence":["supported","unsupported","not-evaluated","not-applicable"]},"token_registry":{"classes":{"fatal":["E_UNKNOWN_CRITICAL_SEMANTIC","E_CLAIM_OUT_OF_DOMAIN"],"gap":["E_IV_NOT_EVALUATED","E_COUNTER_EVIDENCE_NOT_EVALUATED"],"substantive":["E_BASE_EXCEEDS_BOUNDARY","E_MISSING_REQUIRED_EVIDENCE","E_COUNTER_EVIDENCE_UNRESOLVED","P_COUNTER_FAIL"]},"foreign_rejected":[],"roles":{"base_exceeds_boundary":"E_BASE_EXCEEDS_BOUNDARY","claim_out_of_domain":"E_CLAIM_OUT_OF_DOMAIN","counter_evidence_not_evaluated":"E_COUNTER_EVIDENCE_NOT_EVALUATED","counter_evidence_unresolved":"E_COUNTER_EVIDENCE_UNRESOLVED","missing_required_evidence":"E_MISSING_REQUIRED_EVIDENCE","qualifier_not_evaluated":"E_IV_NOT_EVALUATED","unknown_critical":"E_UNKNOWN_CRITICAL_SEMANTIC"}},"vector_bindings":{"WEXP-CORE-01-V002-TV-2001":{"classification":"multi-qualifier-positive","requirement_ids":["WEXP-CORE-01-V002-REQ-A2001"],"source_fixture":"A2001"},"WEXP-CORE-01-V002-TV-2002":{"classification":"unrelated-over-ceiling-positive","requirement_ids":["WEXP-CORE-01-V002-REQ-B2002"],"source_fixture":"B2002"},"WEXP-CORE-01-V002-TV-2003":{"classification":"asserted-base-over-ceiling-negative","requirement_ids":["WEXP-CORE-01-V002-REQ-C2003"],"source_fixture":"C2003"},"WEXP-CORE-01-V002-TV-2004":{"classification":"counter-evidence-all-admissible-negative","requirement_ids":["WEXP-CORE-01-V002-REQ-H2004"],"source_fixture":"H2004"},"WEXP-CORE-01-V002-TV-2005":{"classification":"counter-evidence-non-targeted-positive","requirement_ids":["WEXP-CORE-01-V002-REQ-E2005"],"source_fixture":"E2005"},"WEXP-CORE-01-V002-TV-2006":{"classification":"supplied-fatal-rejection","requirement_ids":["WEXP-CORE-01-V002-REQ-F2006"],"source_fixture":"F2006"},"WEXP-CORE-01-V002-TV-2007":{"classification":"qualifier-domain-fatal","requirement_ids":["WEXP-CORE-01-V002-REQ-G2007"],"source_fixture":"G2007"},"WEXP-CORE-01-V002-TV-2008":{"classification":"gap-only-downgrade","requirement_ids":["WEXP-CORE-01-V002-REQ-H2008"],"source_fixture":"H2008"},"WEXP-CORE-01-V002-TV-2009":{"classification":"counter-evidence-resolved-positive","requirement_ids":["WEXP-CORE-01-V002-REQ-H2009"],"source_fixture":"H2009"}},"verdict_rules":{"precedence":["fatal","substantive","default"],"verdicts":{"default":"accept","fatal":"reject","substantive":"downgrade"}}}
